{
  "input": "films/input/3034981-0-FoxandHareSavetheForest-1080.mp4",
  "narration": "films/narration/imdb123123.m4a",
  "output": "projects\\test_project\\outputs\\final.mp4",
  "segments": [
    {
      "start": 0.5,
      "end": 3.2,
      "score": 0.85
    },
    {
      "start": 15.0,
      "end": 18.4,
      "score": 0.82
    },
    {
      "start": 110.0,
      "end": 113.75,
      "score": 0.79
    }
  ],
  "metadata": {
    "project_id": "test_project",
    "generated_at": "2026-01-01T20:37:26.704647",
    "version": "1.0"
  }
}