{
  "input": "films/input/movie.mp4",
  "narration": "films/narration/narration.m4a",
  "output": "projects\\test_project\\outputs\\final.mp4",
  "segments": [
    {
      "start": 0.5,
      "end": 3.2
    },
    {
      "start": 15.0,
      "end": 18.4
    },
    {
      "start": 110.0,
      "end": 113.75
    },
    {
      "start": 120.0,
      "end": 123.75
    }
  ],
  "metadata": {
    "project_id": "test_project",
    "generated_at": "2026-01-01T18:29:07.271535",
    "version": "1.0"
  }
}